cantica;canto;n_verso;verso
Purgatorio;XVIII;​64;Quest'è 'l principio là onde si piglia
Purgatorio;XVIII;​65;ragion di meritare in voi, secondo
Purgatorio;XVIII;​66;che buoni e rei amori accoglie e viglia.
Purgatorio;XVIII;​67;Color che ragionando andaro al fondo,
Purgatorio;XVIII;​68;"s'accorser d'esta innata libertate;"
Purgatorio;XVIII;​69;però moralità lasciaro al mondo.
Purgatorio;XVIII;​70;Onde, poniam che di necessitate
Purgatorio;XVIII;​71;surga ogne amor che dentro a voi s'accende,
Purgatorio;XVIII;​72;di ritenerlo è in voi la podestate.
Purgatorio;XVIII;​73;La nobile virtù Beatrice intende
Purgatorio;XVIII;​74;per lo libero arbitrio, e però guarda
Purgatorio;XVIII;​75;"che l'abbi a mente, s'a parlar ten prende""."
Purgatorio;XVIII;​76;La luna, quasi a mezza notte tarda,
Purgatorio;XVIII;​77;facea le stelle a noi parer più rade,
Purgatorio;XVIII;​78;"fatta com'un secchion che tuttor arda;"
Purgatorio;XVIII;​79;e correa contro 'l ciel per quelle strade
Purgatorio;XVIII;​80;che 'l sole infiamma allor che quel da Roma
Purgatorio;XVIII;​81;tra ' Sardi e ' Corsi il vede quando cade.
Purgatorio;XVIII;​82;E quell'ombra gentil per cui si noma
Purgatorio;XVIII;​83;Pietola più che villa mantoana,
Purgatorio;XVIII;​84;"del mio carcar diposta avea la soma;"
Purgatorio;XVIII;​85;per ch'io, che la ragione aperta e piana
Purgatorio;XVIII;​86;sovra le mie quistioni avea ricolta,
Purgatorio;XVIII;​87;stava com'om che sonnolento vana.
Purgatorio;XVIII;​88;Ma questa sonnolenza mi fu tolta
Purgatorio;XVIII;​89;subitamente da gente che dopo
Purgatorio;XVIII;​90;le nostre spalle a noi era già volta.
Purgatorio;XVIII;​91;E quale Ismeno già vide e Asopo
Purgatorio;XVIII;​92;lungo di sè di notte furia e calca,
Purgatorio;XVIII;​93;pur che i Teban di Bacco avesser uopo,
Purgatorio;XVIII;​94;cotal per quel giron suo passo falca,
Purgatorio;XVIII;​95;per quel ch'io vidi di color, venendo,
Purgatorio;XVIII;​96;cui buon volere e giusto amor cavalca.
Purgatorio;XVIII;​97;Tosto fur sovr'a noi, perché correndo
Purgatorio;XVIII;​98;"si movea tutta quella turba magna;"
Purgatorio;XVIII;​99;e due dinanzi gridavan piangendo:
Purgatorio;XVIII;​100;"""Maria corse con fretta a la montagna;"
Purgatorio;XVIII;​101;e Cesare, per soggiogare Ilerda,
Purgatorio;XVIII;​102;"punse Marsilia e poi corse in Ispagna""."
Purgatorio;XVIII;​103;"""Ratto, ratto, che 'l tempo non si perda"
Purgatorio;XVIII;​104;"per poco amor"", gridavan li altri appresso,"
Purgatorio;XVIII;​105;"""che studio di ben far grazia rinverda""."
Purgatorio;XVIII;​106;"""O gente in cui fervore aguto adesso"
Purgatorio;XVIII;​107;ricompie forse negligenza e indugio
Purgatorio;XVIII;​108;da voi per tepidezza in ben far messo,
Purgatorio;XVIII;​109;questi che vive, e certo i' non vi bugio,
Purgatorio;XVIII;​110;"vuole andar sù, pur che 'l sol ne riluca;"
Purgatorio;XVIII;​111;"però ne dite ond'è presso il pertugio""."
Purgatorio;XVIII;​112;"Parole furon queste del mio duca;"
Purgatorio;XVIII;​113;"e un di quelli spirti disse: ""Vieni"
Purgatorio;XVIII;​114;di retro a noi, e troverai la buca.
Purgatorio;XVIII;​115;Noi siam di voglia a muoverci sì pieni,
Purgatorio;XVIII;​116;"che restar non potem; però perdona,"
Purgatorio;XVIII;​117;se villania nostra giustizia tieni.
Purgatorio;XVIII;​118;Io fui abate in San Zeno a Verona
Purgatorio;XVIII;​119;sotto lo 'mperio del buon Barbarossa,
Purgatorio;XVIII;​120;di cui dolente ancor Milan ragiona.
Purgatorio;XVIII;​121;E tale ha già l'un piè dentro la fossa,
Purgatorio;XVIII;​122;che tosto piangerà quel monastero,
Purgatorio;XVIII;​123;"e tristo fia d'avere avuta possa;"
Purgatorio;XVIII;​124;perché suo figlio, mal del corpo intero,
Purgatorio;XVIII;​125;e de la mente peggio, e che mal nacque,
Purgatorio;XVIII;​126;"ha posto in loco di suo pastor vero""."
Purgatorio;XVIII;​127;Io non so se più disse o s'ei si tacque,
Purgatorio;XVIII;​128;"tant'era già di là da noi trascorso;"
Purgatorio;XVIII;​129;ma questo intesi, e ritener mi piacque.
Purgatorio;XVIII;​130;E quei che m'era ad ogne uopo soccorso
Purgatorio;XVIII;​131;"disse: ""Volgiti qua: vedine due"
Purgatorio;XVIII;​132;"venir dando a l'accidïa di morso""."
Purgatorio;XVIII;​133;"Di retro a tutti dicean: ""Prima fue"
Purgatorio;XVIII;​134;morta la gente a cui il mar s'aperse,
Purgatorio;XVIII;​135;che vedesse Iordan le rede sue.
Purgatorio;XVIII;​136;E quella che l'affanno non sofferse
Purgatorio;XVIII;​137;fino a la fine col figlio d'Anchise,
Purgatorio;XVIII;​138;"sé stessa a vita sanza gloria offerse""."
Purgatorio;XVIII;​139;Poi quando fuor da noi tanto divise
Purgatorio;XVIII;​140;quell'ombre, che veder più non potiersi,
Purgatorio;XVIII;​141;novo pensiero dentro a me si mise,
Purgatorio;XVIII;​142;"del qual più altri nacquero e diversi;"
Purgatorio;XVIII;​143;e tanto d'uno in altro vaneggiai,
Purgatorio;XVIII;​144;che li occhi per vaghezza ricopersi,
Purgatorio;XVIII;​145;e 'l pensamento in sogno trasmutai.
Purgatorio;XIX;​1;Ne l'ora che non può 'l calor dïurno
Purgatorio;XIX;​2;intepidar più 'l freddo de la luna,
Purgatorio;XIX;​3;vinto da terra, e talor da Saturno
Purgatorio;XIX;​4;- quando i geomanti lor Maggior Fortuna
Purgatorio;XIX;​5;veggiono in orïente, innanzi a l'alba,
Purgatorio;XIX;​6;surger per via che poco le sta bruna -,
Purgatorio;XIX;​7;mi venne in sogno una femmina balba,
Purgatorio;XIX;​8;ne li occhi guercia, e sovra i piè distorta,
Purgatorio;XIX;​9;con le man monche, e di colore scialba.
Purgatorio;XIX;​10;"Io la mirava; e come 'l sol conforta"
Purgatorio;XIX;​11;le fredde membra che la notte aggrava,
Purgatorio;XIX;​12;così lo sguardo mio le facea scorta
Purgatorio;XIX;​13;la lingua, e poscia tutta la drizzava
Purgatorio;XIX;​14;in poco d'ora, e lo smarrito volto,
Purgatorio;XIX;​15;com'amor vuol, così le colorava.
Purgatorio;XIX;​16;Poi ch'ell'avea 'l parlar così disciolto,
Purgatorio;XIX;​17;cominciava a cantar sì, che con pena
Purgatorio;XIX;​18;da lei avrei mio intento rivolto.
Purgatorio;XIX;​19;"""Io son"", cantava, ""io son dolce serena,"
Purgatorio;XIX;​20;"che ' marinari in mezzo mar dismago;"
Purgatorio;XIX;​21;tanto son di piacere a sentir piena!
Purgatorio;XIX;​22;Io volsi Ulisse del suo cammin vago
Purgatorio;XIX;​23;"al canto mio; e qual meco s'ausa,"
Purgatorio;XIX;​24;"rado sen parte; sì tutto l'appago!""."
Purgatorio;XIX;​25;Ancor non era sua bocca richiusa,
Purgatorio;XIX;​26;quand'una donna apparve santa e presta
Purgatorio;XIX;​27;lunghesso me per far colei confusa.
Purgatorio;XIX;​28;"""O Virgilio, Virgilio, chi è questa?"","
Purgatorio;XIX;​29;"fieramente dicea; ed el venìa"
Purgatorio;XIX;​30;con li occhi fitti pur in quella onesta.
Purgatorio;XIX;​31;L'altra prendea, e dinanzi l'apria
Purgatorio;XIX;​32;"fendendo i drappi, e mostravami 'l ventre;"
Purgatorio;XIX;​33;quel mi svegliò col puzzo che n'uscìa.
Purgatorio;XIX;​34;"Io mossi li occhi, e 'l buon maestro: ""Almen tre"
Purgatorio;XIX;​35;"voci t'ho messe!"", dicea, ""Surgi e vieni;"
Purgatorio;XIX;​36;"troviam l'aperta per la qual tu entre""."
Purgatorio;XIX;​37;Sù mi levai, e tutti eran già pieni
Purgatorio;XIX;​38;de l'alto dì i giron del sacro monte,
Purgatorio;XIX;​39;e andavam col sol novo a le reni.
Purgatorio;XIX;​40;Seguendo lui, portava la mia fronte
Purgatorio;XIX;​41;come colui che l'ha di pensier carca,
Purgatorio;XIX;​42;"che fa di sé un mezzo arco di ponte;"
Purgatorio;XIX;​43;"quand'io udi' ""Venite; qui si varca"""
Purgatorio;XIX;​44;parlare in modo soave e benigno,
Purgatorio;XIX;​45;qual non si sente in questa mortal marca.
Purgatorio;XIX;​46;Con l'ali aperte, che parean di cigno,
Purgatorio;XIX;​47;volseci in sù colui che sì parlonne
Purgatorio;XIX;​48;tra due pareti del duro macigno.
Purgatorio;XIX;​49;Mosse le penne poi e ventilonne,
Purgatorio;XIX;​50;"""Qui lugent"" affermando esser beati,"
Purgatorio;XIX;​51;ch'avran di consolar l'anime donne.
Purgatorio;XIX;​52;"""Che hai che pur inver' la terra guati?"","
Purgatorio;XIX;​53;la guida mia incominciò a dirmi,
Purgatorio;XIX;​54;poco amendue da l'angel sormontati.
Purgatorio;XIX;​55;"E io: ""Con tanta sospeccion fa irmi"
Purgatorio;XIX;​56;novella visïon ch'a sé mi piega,
Purgatorio;XIX;​57;"sì ch'io non posso dal pensar partirmi""."
Purgatorio;XIX;​58;"""Vedesti"", disse, ""quell'antica strega"
Purgatorio;XIX;​59;"che sola sovr'a noi omai si piagne;"
Purgatorio;XIX;​60;vedesti come l'uom da lei si slega.
Purgatorio;XIX;​61;"Bastiti, e batti a terra le calcagne;"
Purgatorio;XIX;​62;li occhi rivolgi al logoro che gira
Purgatorio;XIX;​63;"lo rege etterno con le rote magne""."
Purgatorio;XIX;​64;Quale 'l falcon, che prima a' piè si mira,
Purgatorio;XIX;​65;indi si volge al grido e si protende
Purgatorio;XIX;​66;per lo disio del pasto che là il tira,
Purgatorio;XIX;​67;"tal mi fec'io; e tal, quanto si fende"
Purgatorio;XIX;​68;la roccia per dar via a chi va suso,
Purgatorio;XIX;​69;n'andai infin dove 'l cerchiar si prende.
Purgatorio;XIX;​70;Com'io nel quinto giro fui dischiuso,
Purgatorio;XIX;​71;vidi gente per esso che piangea,
Purgatorio;XIX;​72;giacendo a terra tutta volta in giuso.
Purgatorio;XIX;​73;"""Adhaesit pavimento anima mea"""
Purgatorio;XIX;​74;sentia dir lor con sì alti sospiri,
Purgatorio;XIX;​75;che la parola a pena s'intendea.
Purgatorio;XIX;​76;"""O eletti di Dio, li cui soffriri"
Purgatorio;XIX;​77;e giustizia e speranza fa men duri,
Purgatorio;XIX;​78;"drizzate noi verso li alti saliri""."
Purgatorio;XIX;​79;"""Se voi venite dal giacer sicuri,"
Purgatorio;XIX;​80;e volete trovar la via più tosto,
Purgatorio;XIX;​81;"le vostre destre sien sempre di fori""."
Purgatorio;XIX;​82;Così pregò 'l poeta, e sì risposto
Purgatorio;XIX;​83;"poco dinanzi a noi ne fu; per ch'io"
Purgatorio;XIX;​84;nel parlare avvisai l'altro nascosto,
Purgatorio;XIX;​85;e volsi li occhi a li occhi al segnor mio:
Purgatorio;XIX;​86;ond'elli m'assentì con lieto cenno
Purgatorio;XIX;​87;ciò che chiedea la vista del disio.
Purgatorio;XIX;​88;Poi ch'io potei di me fare a mio senno,
Purgatorio;XIX;​89;trassimi sovra quella creatura
Purgatorio;XIX;​90;le cui parole pria notar mi fenno,
Purgatorio;XIX;​91;"dicendo: ""Spirto in cui pianger matura"
Purgatorio;XIX;​92;quel sanza 'l quale a Dio tornar non pòssi,
Purgatorio;XIX;​93;sosta un poco per me tua maggior cura.
Purgatorio;XIX;​94;Chi fosti e perché vòlti avete i dossi
Purgatorio;XIX;​95;al sù, mi dì, e se vuo' ch'io t'impetri
Purgatorio;XIX;​96;"cosa di là ond'io vivendo mossi""."
Purgatorio;XIX;​97;"Ed elli a me: ""Perché i nostri diretri"
Purgatorio;XIX;​98;"rivolga il cielo a sé, saprai; ma prima"
Purgatorio;XIX;​99;scias quod ego fui successor Petri.
Purgatorio;XIX;​100;Intra Sïestri e Chiaveri s'adima
Purgatorio;XIX;​101;una fiumana bella, e del suo nome
Purgatorio;XIX;​102;lo titol del mio sangue fa sua cima.
Purgatorio;XIX;​103;Un mese e poco più prova' io come
Purgatorio;XIX;​104;pesa il gran manto a chi dal fango il guarda,
Purgatorio;XIX;​105;che piuma sembran tutte l'altre some.
Purgatorio;XIX;​106;"La mia conversïone, omè!, fu tarda;"
Purgatorio;XIX;​107;ma, come fatto fui roman pastore,
Purgatorio;XIX;​108;così scopersi la vita bugiarda.
Purgatorio;XIX;​109;Vidi che lì non s'acquetava il core,
Purgatorio;XIX;​110;"né più salir potiesi in quella vita;"
Purgatorio;XIX;​111;per che di questa in me s'accese amore.
Purgatorio;XIX;​112;Fino a quel punto misera e partita
Purgatorio;XIX;​113;"da Dio anima fui, del tutto avara;"
Purgatorio;XIX;​114;or, come vedi, qui ne son punita.
Purgatorio;XIX;​115;Quel ch'avarizia fa, qui si dichiara
Purgatorio;XIX;​116;"in purgazion de l'anime converse;"
Purgatorio;XIX;​117;e nulla pena il monte ha più amara.
Purgatorio;XIX;​118;Sì come l'occhio nostro non s'aderse
Purgatorio;XIX;​119;in alto, fisso a le cose terrene,
Purgatorio;XIX;​120;così giustizia qui a terra il merse.
Purgatorio;XIX;​121;Come avarizia spense a ciascun bene
Purgatorio;XIX;​122;lo nostro amore, onde operar perdési,
Purgatorio;XIX;​123;così giustizia qui stretti ne tene,
Purgatorio;XIX;​124;"ne' piedi e ne le man legati e presi;"
Purgatorio;XIX;​125;e quanto fia piacer del giusto Sire,
Purgatorio;XIX;​126;"tanto staremo immobili e distesi""."
Purgatorio;XIX;​127;"Io m'era inginocchiato e volea dire;"
Purgatorio;XIX;​128;ma com'io cominciai ed el s'accorse,
Purgatorio;XIX;​129;solo ascoltando, del mio reverire,
Purgatorio;XIX;​130;"""Qual cagion"", disse, ""in giù così ti torse?""."
Purgatorio;XIX;​131;"E io a lui: ""Per vostra dignitate"
Purgatorio;XIX;​132;"mia coscïenza dritto mi rimorse""."
Purgatorio;XIX;​133;"""Drizza le gambe, lèvati sù, frate!"","
Purgatorio;XIX;​134;"rispuose; ""non errar: conservo sono"
Purgatorio;XIX;​135;teco e con li altri ad una podestate.
Purgatorio;XIX;​136;Se mai quel santo evangelico suono
Purgatorio;XIX;​137;"che dice ""Neque nubent"" intendesti,"
Purgatorio;XIX;​138;ben puoi veder perch'io così ragiono.
Purgatorio;XIX;​139;"Vattene omai: non vo' che più t'arresti;"
Purgatorio;XIX;​140;ché la tua stanza mio pianger disagia,
Purgatorio;XIX;​141;col qual maturo ciò che tu dicesti.
Purgatorio;XIX;​142;Nepote ho io di là c'ha nome Alagia,
Purgatorio;XIX;​143;buona da sé, pur che la nostra casa
Purgatorio;XIX;​144;"non faccia lei per essempro malvagia;"
Purgatorio;XIX;​145;"e questa sola di là m'è rimasa""."
Purgatorio;XX;​1;"Contra miglior voler voler mal pugna;"
Purgatorio;XX;​2;onde contra 'l piacer mio, per piacerli,
Purgatorio;XX;​3;trassi de l'acqua non sazia la spugna.
Purgatorio;XX;​4;"Mossimi; e 'l duca mio si mosse per li"
Purgatorio;XX;​5;luoghi spediti pur lungo la roccia,
Purgatorio;XX;​6;"come si va per muro stretto a' merli;"
Purgatorio;XX;​7;ché la gente che fonde a goccia a goccia
Purgatorio;XX;​8;per li occhi il mal che tutto 'l mondo occupa,
Purgatorio;XX;​9;da l'altra parte in fuor troppo s'approccia.
Purgatorio;XX;​10;Maladetta sie tu, antica lupa,
Purgatorio;XX;​11;che più che tutte l'altre bestie hai preda
Purgatorio;XX;​12;per la tua fame sanza fine cupa!
Purgatorio;XX;​13;O ciel, nel cui girar par che si creda
Purgatorio;XX;​14;le condizion di qua giù trasmutarsi,
Purgatorio;XX;​15;quando verrà per cui questa disceda?
Purgatorio;XX;​16;Noi andavam con passi lenti e scarsi,
Purgatorio;XX;​17;e io attento a l'ombre, ch'i' sentia
Purgatorio;XX;​18;"pietosamente piangere e lagnarsi;"
Purgatorio;XX;​19;"e per ventura udi' ""Dolce Maria!"""
Purgatorio;XX;​20;dinanzi a noi chiamar così nel pianto
Purgatorio;XX;​21;"come fa donna che in parturir sia;"
Purgatorio;XX;​22;"e seguitar: ""Povera fosti tanto,"
Purgatorio;XX;​23;quanto veder si può per quello ospizio
Purgatorio;XX;​24;"dove sponesti il tuo portato santo""."
Purgatorio;XX;​25;"Seguentemente intesi: ""O buon Fabrizio,"
Purgatorio;XX;​26;con povertà volesti anzi virtute
Purgatorio;XX;​27;"che gran ricchezza posseder con vizio""."
Purgatorio;XX;​28;Queste parole m'eran sì piaciute,
Purgatorio;XX;​29;ch'io mi trassi oltre per aver contezza
Purgatorio;XX;​30;di quello spirto onde parean venute.
Purgatorio;XX;​31;Esso parlava ancor de la larghezza
Purgatorio;XX;​32;che fece Niccolò a le pulcelle,
Purgatorio;XX;​33;per condurre ad onor lor giovinezza.
Purgatorio;XX;​34;"""O anima che tanto ben favelle,"
Purgatorio;XX;​35;"dimmi chi fosti"", dissi, ""e perché sola"
Purgatorio;XX;​36;tu queste degne lode rinovelle.
Purgatorio;XX;​37;Non fia sanza mercé la tua parola,
Purgatorio;XX;​38;s'io ritorno a compiér lo cammin corto
Purgatorio;XX;​39;"di quella vita ch'al termine vola""."
Purgatorio;XX;​40;"Ed elli: ""Io ti dirò, non per conforto"
Purgatorio;XX;​41;ch'io attenda di là, ma perché tanta
Purgatorio;XX;​42;grazia in te luce prima che sie morto.
Purgatorio;XX;​43;Io fui radice de la mala pianta
Purgatorio;XX;​44;che la terra cristiana tutta aduggia,
Purgatorio;XX;​45;sì che buon frutto rado se ne schianta.
Purgatorio;XX;​46;Ma se Doagio, Lilla, Guanto e Bruggia
Purgatorio;XX;​47;"potesser, tosto ne saria vendetta;"
Purgatorio;XX;​48;e io la cheggio a lui che tutto giuggia.
Purgatorio;XX;​49;"Chiamato fui di là Ugo Ciappetta;"
Purgatorio;XX;​50;di me son nati i Filippi e i Luigi
Purgatorio;XX;​51;per cui novellamente è Francia retta.
Purgatorio;XX;​52;Figliuol fu' io d'un beccaio di Parigi:
Purgatorio;XX;​53;quando li regi antichi venner meno
Purgatorio;XX;​54;tutti, fuor ch'un renduto in panni bigi,
Purgatorio;XX;​55;trova'mi stretto ne le mani il freno
Purgatorio;XX;​56;del governo del regno, e tanta possa
Purgatorio;XX;​57;di nuovo acquisto, e sì d'amici pieno,
Purgatorio;XX;​58;ch'a la corona vedova promossa
Purgatorio;XX;​59;la testa di mio figlio fu, dal quale
Purgatorio;XX;​60;cominciar di costor le sacrate ossa.
Purgatorio;XX;​61;Mentre che la gran dota provenzale
Purgatorio;XX;​62;al sangue mio non tolse la vergogna,
Purgatorio;XX;​63;poco valea, ma pur non facea male.
Purgatorio;XX;​64;Lì cominciò con forza e con menzogna
Purgatorio;XX;​65;"la sua rapina; e poscia, per ammenda,"
Purgatorio;XX;​66;Pontì e Normandia prese e Guascogna.
Purgatorio;XX;​67;Carlo venne in Italia e, per ammenda,
Purgatorio;XX;​68;"vittima fé di Curradino; e poi"
Purgatorio;XX;​69;ripinse al ciel Tommaso, per ammenda.
Purgatorio;XX;​70;Tempo vegg'io, non molto dopo ancoi,
Purgatorio;XX;​71;che tragge un altro Carlo fuor di Francia,
Purgatorio;XX;​72;per far conoscer meglio e sé e ' suoi.
Purgatorio;XX;​73;Sanz'arme n'esce e solo con la lancia
Purgatorio;XX;​74;con la qual giostrò Giuda, e quella ponta
Purgatorio;XX;​75;sì, ch'a Fiorenza fa scoppiar la pancia.
Purgatorio;XX;​76;Quindi non terra, ma peccato e onta
Purgatorio;XX;​77;guadagnerà, per sé tanto più grave,
Purgatorio;XX;​78;quanto più lieve simil danno conta.
Purgatorio;XX;​79;L'altro, che già uscì preso di nave,
Purgatorio;XX;​80;veggio vender sua figlia e patteggiarne
Purgatorio;XX;​81;come fanno i corsar de l'altre schiave.
Purgatorio;XX;​82;O avarizia, che puoi tu più farne,
Purgatorio;XX;​83;poscia c'ha' il mio sangue a te sì tratto,
Purgatorio;XX;​84;che non si cura de la propria carne?
Purgatorio;XX;​85;Perché men paia il mal futuro e 'l fatto,
Purgatorio;XX;​86;veggio in Alagna intrar lo fiordaliso,
Purgatorio;XX;​87;e nel vicario suo Cristo esser catto.
Purgatorio;XX;​88;"Veggiolo un'altra volta esser deriso;"
Purgatorio;XX;​89;veggio rinovellar l'aceto e 'l fiele,
Purgatorio;XX;​90;e tra vivi ladroni esser anciso.
Purgatorio;XX;​91;Veggio il novo Pilato sì crudele,
Purgatorio;XX;​92;che ciò nol sazia, ma sanza decreto
Purgatorio;XX;​93;portar nel Tempio le cupide vele.
Purgatorio;XX;​94;O Segnor mio, quando sarò io lieto
Purgatorio;XX;​95;a veder la vendetta che, nascosa,
Purgatorio;XX;​96;fa dolce l'ira tua nel tuo secreto?
Purgatorio;XX;​97;Ciò ch'io dicea di quell'unica sposa
Purgatorio;XX;​98;de lo Spirito Santo e che ti fece
Purgatorio;XX;​99;verso me volger per alcuna chiosa,
Purgatorio;XX;​100;tanto è risposto a tutte nostre prece
Purgatorio;XX;​101;"quanto 'l dì dura; ma com'el s'annotta,"
Purgatorio;XX;​102;contrario suon prendemo in quella vece.
Purgatorio;XX;​103;Noi repetiam Pigmalïon allotta,
Purgatorio;XX;​104;cui traditore e ladro e paricida
Purgatorio;XX;​105;"fece la voglia sua de l'oro ghiotta;"
Purgatorio;XX;​106;e la miseria de l'avaro Mida,
Purgatorio;XX;​107;che seguì a la sua dimanda gorda,
Purgatorio;XX;​108;per la qual sempre convien che si rida.
Purgatorio;XX;​109;Del folle Acàn ciascun poi si ricorda,
Purgatorio;XX;​110;come furò le spoglie, sì che l'ira
Purgatorio;XX;​111;di Iosüè qui par ch'ancor lo morda.
Purgatorio;XX;​112;"Indi accusiam col marito Saffira;"
Purgatorio;XX;​113;"lodiamo i calci ch'ebbe Elïodoro;"
Purgatorio;XX;​114;e in infamia tutto 'l monte gira
Purgatorio;XX;​115;"Polinestòr ch'ancise Polidoro;"
Purgatorio;XX;​116;"ultimamente ci si grida: ""Crasso,"
Purgatorio;XX;​117;"dilci, che 'l sai: di che sapore è l'oro?""."
Purgatorio;XX;​118;Talor parla l'uno alto e l'altro basso,
Purgatorio;XX;​119;secondo l'affezion ch'ad ir ci sprona
Purgatorio;XX;​120;ora a maggiore e ora a minor passo:
Purgatorio;XX;​121;però al ben che 'l dì ci si ragiona,
Purgatorio;XX;​122;"dianzi non era io sol; ma qui da presso"
Purgatorio;XX;​123;"non alzava la voce altra persona""."
Purgatorio;XX;​124;Noi eravam partiti già da esso,
Purgatorio;XX;​125;e brigavam di soverchiar la strada
Purgatorio;XX;​126;tanto quanto al poder n'era permesso,
Purgatorio;XX;​127;quand'io senti', come cosa che cada,
Purgatorio;XX;​128;"tremar lo monte; onde mi prese un gelo"
Purgatorio;XX;​129;qual prender suol colui ch'a morte vada.
Purgatorio;XX;​130;Certo non si scoteo sì forte Delo,
Purgatorio;XX;​131;pria che Latona in lei facesse 'l nido
Purgatorio;XX;​132;a parturir li due occhi del cielo.
Purgatorio;XX;​133;Poi cominciò da tutte parti un grido
Purgatorio;XX;​134;tal, che 'l maestro inverso me si feo,
Purgatorio;XX;​135;"dicendo: ""Non dubbiar, mentr'io ti guido""."
Purgatorio;XX;​136;"""Glorïa in excelsis"" tutti ""Deo"""
Purgatorio;XX;​137;dicean, per quel ch'io da' vicin compresi,
Purgatorio;XX;​138;onde intender lo grido si poteo.
Purgatorio;XX;​139;No' istavamo immobili e sospesi
Purgatorio;XX;​140;come i pastor che prima udir quel canto,
Purgatorio;XX;​141;fin che 'l tremar cessò ed el compiési.
Purgatorio;XX;​142;Poi ripigliammo nostro cammin santo,
Purgatorio;XX;​143;guardando l'ombre che giacean per terra,
Purgatorio;XX;​144;tornate già in su l'usato pianto.
Purgatorio;XX;​145;Nulla ignoranza mai con tanta guerra
Purgatorio;XX;​146;mi fé desideroso di sapere,
Purgatorio;XX;​147;se la memoria mia in ciò non erra,
Purgatorio;XX;​148;"quanta pareami allor, pensando, avere;"
Purgatorio;XX;​149;né per la fretta dimandare er'oso,
Purgatorio;XX;​150;né per me lì potea cosa vedere:
Purgatorio;XX;​151;così m'andava timido e pensoso.
Purgatorio;XXI;​1;La sete natural che mai non sazia
Purgatorio;XXI;​2;se non con l'acqua onde la femminetta
Purgatorio;XXI;​3;samaritana domandò la grazia,
Purgatorio;XXI;​4;mi travagliava, e pungeami la fretta
Purgatorio;XXI;​5;per la 'mpacciata via dietro al mio duca,
Purgatorio;XXI;​6;e condoleami a la giusta vendetta.
Purgatorio;XXI;​7;Ed ecco, sì come ne scrive Luca
Purgatorio;XXI;​8;che Cristo apparve a' due ch'erano in via,
Purgatorio;XXI;​9;già surto fuor de la sepulcral buca,
Purgatorio;XXI;​10;ci apparve un'ombra, e dietro a noi venìa,
Purgatorio;XXI;​11;"dal piè guardando la turba che giace;"
Purgatorio;XXI;​12;né ci addemmo di lei, sì parlò pria,
Purgatorio;XXI;​13;"dicendo: ""O frati miei, Dio vi dea pace""."
Purgatorio;XXI;​14;Noi ci volgemmo sùbiti, e Virgilio
Purgatorio;XXI;​15;rendéli 'l cenno ch'a ciò si conface.
Purgatorio;XXI;​16;"Poi cominciò: ""Nel beato concilio"
Purgatorio;XXI;​17;ti ponga in pace la verace corte
Purgatorio;XXI;​18;"che me rilega ne l'etterno essilio""."
Purgatorio;XXI;​19;"""Come!"", diss'elli, e parte andavam forte:"
Purgatorio;XXI;​20;"""se voi siete ombre che Dio sù non degni,"
Purgatorio;XXI;​21;"chi v'ha per la sua scala tanto scorte?""."
Purgatorio;XXI;​22;"E 'l dottor mio: ""Se tu riguardi a' segni"
Purgatorio;XXI;​23;che questi porta e che l'angel profila,
Purgatorio;XXI;​24;ben vedrai che coi buon convien ch'e' regni.
Purgatorio;XXI;​25;Ma perché lei che dì e notte fila
Purgatorio;XXI;​26;non li avea tratta ancora la conocchia
Purgatorio;XXI;​27;che Cloto impone a ciascuno e compila,
Purgatorio;XXI;​28;l'anima sua, ch'è tua e mia serocchia,
Purgatorio;XXI;​29;venendo sù, non potea venir sola,
Purgatorio;XXI;​30;però ch'al nostro modo non adocchia.
Purgatorio;XXI;​31;Ond'io fui tratto fuor de l'ampia gola
Purgatorio;XXI;​32;d'inferno per mostrarli, e mosterrolli
Purgatorio;XXI;​33;oltre, quanto 'l potrà menar mia scola.
Purgatorio;XXI;​34;Ma dimmi, se tu sai, perché tai crolli
Purgatorio;XXI;​35;diè dianzi 'l monte, e perché tutto ad una
Purgatorio;XXI;​36;"parve gridare infino a' suoi piè molli""."
Purgatorio;XXI;​37;Sì mi diè, dimandando, per la cruna
Purgatorio;XXI;​38;del mio disio, che pur con la speranza
Purgatorio;XXI;​39;si fece la mia sete men digiuna.
Purgatorio;XXI;​40;"Quei cominciò: ""Cosa non è che sanza"
Purgatorio;XXI;​41;ordine senta la religïone
Purgatorio;XXI;​42;de la montagna, o che sia fuor d'usanza.
Purgatorio;XXI;​43;Libero è qui da ogne alterazione:
Purgatorio;XXI;​44;di quel che 'l ciel da sé in sé riceve
Purgatorio;XXI;​45;esser ci puote, e non d'altro, cagione.
Purgatorio;XXI;​46;Per che non pioggia, non grando, non neve,
Purgatorio;XXI;​47;non rugiada, non brina più sù cade
Purgatorio;XXI;​48;"che la scaletta di tre gradi breve;"
Purgatorio;XXI;​49;nuvole spesse non paion né rade,
Purgatorio;XXI;​50;né coruscar, né figlia di Taumante,
Purgatorio;XXI;​51;"che di là cangia sovente contrade;"
Purgatorio;XXI;​52;secco vapor non surge più avante
Purgatorio;XXI;​53;ch'al sommo d'i tre gradi ch'io parlai,
Purgatorio;XXI;​54;dov'ha 'l vicario di Pietro le piante.
Purgatorio;XXI;​55;"Trema forse più giù poco o assai;"
Purgatorio;XXI;​56;ma per vento che 'n terra si nasconda,
Purgatorio;XXI;​57;non so come, qua sù non tremò mai.
